userId,id,title
1,1,sunt aut facere repellat provident occaecati excepturi optio reprehenderit
1,3,ea molestias quasi exercitationem repellat qui ipsa sit aut
1,6,dolorem eum magni eos aperiam quia
1,9,nesciunt iure omnis dolorem tempora et accusantium
2,11,et ea vero quia laudantium autem
2,12,in quibusdam tempore odit est dolorem
2,13,dolorum ut in voluptas mollitia et saepe quo animi
2,16,sint suscipit perspiciatis velit dolorum rerum ipsa laboriosam odio
2,17,fugit voluptas sed molestias voluptatem provident
2,18,voluptate et itaque vero tempora molestiae
2,19,adipisci placeat illum aut reiciendis qui
2,20,doloribus ad provident suscipit at
3,21,asperiores ea ipsam voluptatibus modi minima quia sint
3,22,dolor sint quo a velit explicabo quia nam
3,24,autem hic labore sunt dolores incidunt
3,27,quasi id et eos tenetur aut quo autem
3,28,delectus ullam et corporis nulla voluptas sequi
3,29,iusto eius quod necessitatibus culpa ea
3,30,a quo magni similique perferendis
4,31,ullam ut quidem id aut vel consequuntur
4,33,qui explicabo molestiae dolorem
4,35,id nihil consequatur molestias animi provident
4,36,fuga nam accusamus voluptas reiciendis itaque
4,37,provident vel ut sit ratione est
4,38,explicabo et eos deleniti nostrum ab id repellendus
4,39,eos dolorem iste accusantium est eaque quam
5,42,commodi ullam sint et excepturi error explicabo praesentium voluptas
5,43,eligendi iste nostrum consequuntur adipisci praesentium sit beatae perferendis
5,45,ut numquam possimus omnis eius suscipit laudantium iure
5,46,aut quo modi neque nostrum ducimus
5,47,quibusdam cumque rem aut deserunt
5,48,ut voluptatem illum ea doloribus itaque eos
5,49,laborum non sunt aut ut assumenda perspiciatis voluptas
5,50,repellendus qui recusandae incidunt voluptates tenetur qui omnis exercitationem
6,51,soluta aliquam aperiam consequatur illo quis voluptas
6,52,qui enim et consequuntur quia animi quis voluptate quibusdam
6,54,sit asperiores ipsam eveniet odio non quia
6,55,sit vel voluptatem et non libero
6,58,voluptatum itaque dolores nisi et quasi
6,59,qui commodi dolor at maiores et quis id accusantium
6,60,consequatur placeat omnis quisquam quia reprehenderit fugit veritatis facere
7,61,voluptatem doloribus consectetur est ut ducimus
7,63,voluptas blanditiis repellendus animi ducimus error sapiente et suscipit
7,64,et fugit quas eum in in aperiam quod
7,67,aliquid eos sed fuga est maxime repellendus
7,68,odio quis facere architecto reiciendis optio
7,69,fugiat quod pariatur odit minima
8,71,et iusto veniam et illum aut fuga
8,72,sint hic doloribus consequatur eos non id
8,73,consequuntur deleniti eos quia temporibus ab aliquid at
8,74,enim unde ratione doloribus quas enim ut sit sapiente
8,75,dignissimos eum dolor ut enim et delectus in
8,76,doloremque officiis ad et non perferendis
8,77,necessitatibus quasi exercitationem odio
8,78,quam voluptatibus rerum veritatis
8,79,pariatur consequatur quia magnam autem omnis non amet
8,80,labore in ex et explicabo corporis aut quas
9,81,tempora rem veritatis voluptas quo dolores vero
9,82,laudantium voluptate suscipit sunt enim enim
9,83,odit et voluptates doloribus alias odio et
9,84,optio ipsam molestias necessitatibus occaecati facilis veritatis dolores aut
9,85,dolore veritatis porro provident adipisci blanditiis et sunt
9,89,sint soluta et vel magnam aut ut sed qui
9,90,ad iusto omnis odit dolor voluptatibus
10,94,qui qui voluptates illo iste minima
10,95,id minus libero illum nam ad officiis
10,96,quaerat velit veniam amet cupiditate aut numquam ut sequi
10,97,quas fugiat ut perspiciatis vero provident
10,99,temporibus sit alias delectus eligendi possimus magni
10,100,at nam consequatur ea labore ea harum
